{
  "$schema": "http://json-schema.org/draft-07/schema#",
  "title": "Gene Program Functional Analysis",
  "type": "object",
  "required": ["context", "input_genes", "programs", "version"],
  "definitions": {
    "atomic_term": {
      "type": "object",
      "required": ["name", "citation"],
      "properties": {
        "ontology_id": {
          "type": "string",
          "description": "ontology term CURIE e.g., GO:0005576, GO:0008150, GO:0003674."
        },
        "name": {
          "type": "string",
          "description": "atomic term to be mapped"
        },
        "ontology_label": {
          "type": "string",
          "description": "ontology label e.g., cellular_component, biological_process, molecular_function"
        },
        "citation": {
          "type":"array",
          "items": {
            "$ref": "#/definitions/citation"
          },
          "description": "Citations supporting "
        },
          "Genes": {
              "type": "array",
              "items": {
                  "type": "string"
              },
              "description": "Genes of the program whose products are involved in this process or compoent."
          }
      },
      "additionalProperties": false
    },
    "citation": {
      "type": "object",
      "required": ["reference"],
      "properties": {
        "reference": {
          "type": "string",
          "description": "Free-text reference (e.g., authors, title, journal, year)"
        },
        "id": {
          "type": "string",
          "description": "Optional PMID, DOI, or URL"
        },
        "type": {
          "type": "string",
          "enum": ["PMID", "DOI", "URL"]
        },
        "notes": {
          "type": "string",
          "description": "Why this citation supports the claim"
        }
      },
      "additionalProperties": false
    }
  },
  "properties": {
    "context": {
      "type": "object",
      "required": ["cell_type", "disease"],
      "properties": {
        "cell_type": { "type": "string" },
        "disease": { "type": "string" },
        "tissue": { "type": "string" }
      },
      "additionalProperties": false
    },
    "input_genes": {
      "type": "array",
      "items": { "type": "string", "minLength": 1 },
      "minItems": 1,
      "uniqueItems": true
    },
    "programs": {
      "type": "array",
      "minItems": 1,
      "items": {
        "type": "object",
        "required": [
          "program_name",
          "description",
          "predicted_cellular_impact",
          "evidence_summary",
          "citations",
          "confidence_score",
          "significance_score",
          "supporting_genes",
          "supporting_gene_count"
        ],
        "properties": {
          "program_name": { 
            "type": "string", 
            "minLength": 1 , 
            "description": "Concise name of the gene program"},
          "theme": { "type": "string", "description": "Optional higher-order theme" },
          "description": { "type": "string", "minLength": 1 },
          "atomic_biological_processes": {
            "type": "array",
            "description": "A list of atomic biological process terms extracted from the description.",
            "items": { "$ref": "#/definitions/atomic_term" }
          },
          "atomic_cellular_components": {
            "type": "array",
            "description": "A list of atomic cellular component terms extracted from the description.",
            "items": { "$ref": "#/definitions/atomic_term" }
          },
          "predicted_cellular_impact": {
            "type": "array",
            "minItems": 1,
            "items": {
              "type": "string",
              "description": "Concise bullet-level impacts (e.g., ‘enhanced focal adhesion signaling’)"
            }
          },
          "evidence_summary": { "type": "string", "minLength": 1 },
          "citations": {
            "type": "array",
            "minItems": 1,
            "items": {
              "$ref": "#/definitions/citation"
            }
          },
          "confidence_score": { "type": "number", "minimum": 0.0, "maximum": 1.0 },
          "significance_score": { "type": "number", "minimum": 0.0, "maximum": 1.0 },
          "supporting_genes": {
            "type": "array",
            "minItems": 1,
            "items": { "type": "string" },
            "uniqueItems": true
          },
          "supporting_gene_count": { "type": "integer", "minimum": 1 },
          "required_components_present": {
            "type": "boolean",
            "description": "Whether most/all required pathway components are present"
          }
        },
        "additionalProperties": false
      }
    },
    "method": {
      "type": "object",
      "description": "Optional trace of how programs were derived",
      "properties": {
        "clustering_basis": {
          "type": "array",
          "items": { "type": "string" },
          "description": "e.g., pathway databases, co-citation, PPI, co-expression"
        },
        "notes": { "type": "string" }
      },
      "additionalProperties": false
    },
    "version": { "type": "string" }
  },
  "additionalProperties": false
}